{
  "schema_version": "father-osint.search-journal.v0.1",
  "journal_id": "JRN-SYNTH-0005",
  "case_id": "CASE-SYNTH-0001",
  "sequence": 5,
  "timestamp_utc": "2026-09-01T15:07:00Z",
  "actor": {"actor_id":"red-team-synthetic","actor_type":"AGENT","version":"0.1"},
  "action_type": "CHALLENGE",
  "stream": "RED_TEAM_SOURCE_QUALITY",
  "query_plan_id": "QPLAN-SYNTH-0001",
  "job_id": null,
  "query_or_action": "Challenge the registration-address interpretation",
  "source_or_transform_ids": ["SRC-0001"],
  "result_code": "REVIEWED",
  "result_summary": "Red Team ограничил вывод регистрационной связью и отклонил предположение о фактической деятельности.",
  "new_entities": [],
  "new_relations": [],
  "new_claims": [],
  "new_findings": ["FND-0001"],
  "new_research_gaps": [],
  "confidence_changes": [],
  "next_pivots": ["Preserve GAP-SYNTH-0001 as report limitation"],
  "access_class": "PUBLIC",
  "previous_entry_hash": "3acb7ebd8e635e12ea6930861d98c89eba735ea2fa23e4331fa4882ab262b7be",
  "entry_hash": "aea25d64be7c04a6559e19339ae3c149095282e91675f08975f696b8e353812a",
  "append_only": true,
  "synthetic": true
}
