{
  "schema_version": "father-osint.search-journal.v0.1",
  "journal_id": "JRN-SYNTH-0002",
  "case_id": "CASE-SYNTH-0001",
  "sequence": 2,
  "timestamp_utc": "2026-09-01T15:04:00Z",
  "actor": {"actor_id":"fixture-orchestrator","actor_type":"SYSTEM","version":"0.1"},
  "action_type": "QUERY",
  "stream": "BUSINESS_TRANSACTIONS_LOGISTICS",
  "query_plan_id": "QPLAN-SYNTH-0001",
  "job_id": null,
  "query_or_action": "Check operational presence at ENT-0002",
  "source_or_transform_ids": [],
  "result_code": "NO_HIT",
  "result_summary": "В синтетическом корпусе нет доказательств фактического присутствия или деятельности.",
  "new_entities": [],
  "new_relations": [],
  "new_claims": [],
  "new_findings": [],
  "new_research_gaps": ["GAP-SYNTH-0001"],
  "confidence_changes": [],
  "next_pivots": ["Seek independent operational evidence before any broader report statement"],
  "access_class": "PUBLIC",
  "previous_entry_hash": "c7031a1fd679f21d59f7a8e2f57b7f262b647c7de77938f46605eb4c128019a7",
  "entry_hash": "908380793c0af7f7df53cd3e262244665fbaa90632ec77901b74333fd6ff1888",
  "append_only": true,
  "synthetic": true
}
