{
  "schema_version": "father-osint.search-journal.v0.1",
  "journal_id": "JRN-SYNTH-0003",
  "case_id": "CASE-SYNTH-0001",
  "sequence": 3,
  "timestamp_utc": "2026-09-01T15:05:00Z",
  "actor": {"actor_id":"fixture-orchestrator","actor_type":"SYSTEM","version":"0.1"},
  "action_type": "QUERY",
  "stream": "DIGITAL_FOOTPRINT",
  "query_plan_id": "QPLAN-SYNTH-0001",
  "job_id": null,
  "query_or_action": "Check fixture corpus for domain, email and public accounts",
  "source_or_transform_ids": [],
  "result_code": "NO_HIT",
  "result_summary": "Цифровые идентификаторы не выявлены в пределах синтетического корпуса.",
  "new_entities": [],
  "new_relations": [],
  "new_claims": [],
  "new_findings": [],
  "new_research_gaps": [],
  "confidence_changes": [],
  "next_pivots": ["Keep digital footprint marked unchecked outside fixture scope"],
  "access_class": "PUBLIC",
  "previous_entry_hash": "908380793c0af7f7df53cd3e262244665fbaa90632ec77901b74333fd6ff1888",
  "entry_hash": "bfcde790b4659aec2d474e192926a416a1e66c2e9f141520530da2f54a7aae5d",
  "append_only": true,
  "synthetic": true
}
