{
  "schema_version": "father-osint.search-journal.v0.1",
  "journal_id": "JRN-SYNTH-0004",
  "case_id": "CASE-SYNTH-0001",
  "sequence": 4,
  "timestamp_utc": "2026-09-01T15:06:00Z",
  "actor": {"actor_id":"fixture-orchestrator","actor_type":"SYSTEM","version":"0.1"},
  "action_type": "QUERY",
  "stream": "LEGAL_SANCTIONS_ADVERSE",
  "query_plan_id": "QPLAN-SYNTH-0001",
  "job_id": null,
  "query_or_action": "Check fixture corpus for legal, sanctions and adverse records",
  "source_or_transform_ids": [],
  "result_code": "NO_HIT",
  "result_summary": "Негативные правовые сведения не выявлены в пределах синтетического корпуса.",
  "new_entities": [],
  "new_relations": [],
  "new_claims": [],
  "new_findings": [],
  "new_research_gaps": [],
  "confidence_changes": [],
  "next_pivots": ["Do not convert NO_HIT into a real-world absence claim"],
  "access_class": "PUBLIC",
  "previous_entry_hash": "bfcde790b4659aec2d474e192926a416a1e66c2e9f141520530da2f54a7aae5d",
  "entry_hash": "3acb7ebd8e635e12ea6930861d98c89eba735ea2fa23e4331fa4882ab262b7be",
  "append_only": true,
  "synthetic": true
}
