{
  "schema_version": "father-osint.search-journal.v0.1",
  "journal_id": "JRN-SYNTH-0001",
  "case_id": "CASE-SYNTH-0001",
  "sequence": 1,
  "timestamp_utc": "2026-09-01T15:03:00Z",
  "actor": {"actor_id":"fixture-orchestrator","actor_type":"SYSTEM","version":"0.1"},
  "action_type": "COLLECT",
  "stream": "ENTITY_REGISTRY",
  "query_plan_id": "QPLAN-SYNTH-0001",
  "job_id": "JOB-SYNTH-REG-0001",
  "query_or_action": "Resolve ENT-0001 in synthetic registry",
  "source_or_transform_ids": ["SRC-0001","TRN-SYNTH-REGISTRY-LOOKUP"],
  "result_code": "FOUND",
  "result_summary": "Получены source capture, адресный claim и регистрационная связь.",
  "new_entities": ["ENT-0001","ENT-0002"],
  "new_relations": ["REL-0001"],
  "new_claims": ["CLM-0001"],
  "new_findings": [],
  "new_research_gaps": [],
  "confidence_changes": [],
  "next_pivots": ["Check namesake candidate ENT-0003"],
  "access_class": "PUBLIC",
  "previous_entry_hash": null,
  "entry_hash": "c7031a1fd679f21d59f7a8e2f57b7f262b647c7de77938f46605eb4c128019a7",
  "append_only": true,
  "synthetic": true
}
